{
  "$schema": "https://json-schema.org/draft/2020-12/schema",
  "$id": "https://github.com/kobadaidesu/hook-test/docs/commit-snapshot.schema.json",
  "title": "commitcoach commit.snapshot event",
  "description": "One commit and its changes relative to the first parent (or the empty tree for a root commit). Produced by `commitcoach export` and by the post-commit hook. Schema version 1.0.",
  "type": "object",
  "additionalProperties": false,
  "required": ["schema_version", "event_type", "captured_at", "repository", "commit", "comparison", "files", "summary", "warnings"],
  "properties": {
    "schema_version": { "const": "1.0" },
    "event_type": {
      "const": "commit.snapshot",
      "description": "Always commit.snapshot, for hook captures and manual exports alike."
    },
    "captured_at": {
      "type": "string",
      "format": "date-time",
      "description": "When this document was produced (RFC 3339, UTC). Not a commit date."
    },
    "repository": { "$ref": "#/$defs/repository" },
    "commit": { "$ref": "#/$defs/commit" },
    "comparison": { "$ref": "#/$defs/comparison" },
    "files": {
      "type": "array",
      "items": { "$ref": "#/$defs/file" },
      "description": "Changed files in Git's order (by path), at most the file limit (100 by default)."
    },
    "summary": { "$ref": "#/$defs/summary" },
    "warnings": {
      "type": "array",
      "items": { "type": "string" },
      "description": "Human-readable notes: merge comparison, limits reached, lossy UTF-8 conversions, git messages."
    }
  },
  "$defs": {
    "objectId": {
      "type": "string",
      "pattern": "^[0-9a-f]+$",
      "description": "Full object name in lowercase hex (40 characters for SHA-1 repositories, 64 for SHA-256)."
    },
    "repository": {
      "type": "object",
      "additionalProperties": false,
      "required": ["name", "current_branch"],
      "properties": {
        "name": {
          "type": "string",
          "description": "Directory name of the repository, for display only. Not unique."
        },
        "current_branch": {
          "type": ["string", "null"],
          "description": "Branch checked out when the document was produced (not necessarily a branch containing the commit). null when HEAD is detached."
        }
      }
    },
    "commit": {
      "type": "object",
      "additionalProperties": false,
      "required": ["sha", "parents", "message", "author_name", "authored_at", "committed_at"],
      "properties": {
        "sha": { "$ref": "#/$defs/objectId" },
        "parents": {
          "type": "array",
          "items": { "$ref": "#/$defs/objectId" },
          "description": "Parents as recorded in the commit object, first parent first. Empty for a root commit."
        },
        "message": { "type": "string", "description": "Full commit message, unmodified (usually ends with a newline)." },
        "author_name": { "type": "string" },
        "authored_at": { "type": "string", "format": "date-time", "description": "RFC 3339 with the author's UTC offset." },
        "committed_at": { "type": "string", "format": "date-time", "description": "RFC 3339 with the committer's UTC offset." }
      }
    },
    "comparison": {
      "type": "object",
      "additionalProperties": false,
      "required": ["strategy", "base_sha"],
      "properties": {
        "strategy": {
          "enum": ["first_parent", "empty_tree"],
          "description": "first_parent: compared with commit.parents[0] (ordinary and merge commits). empty_tree: root commit compared with the empty tree."
        },
        "base_sha": {
          "oneOf": [{ "$ref": "#/$defs/objectId" }, { "type": "null" }],
          "description": "The first parent, or null for empty_tree."
        }
      },
      "oneOf": [
        {
          "properties": { "strategy": { "const": "first_parent" }, "base_sha": { "$ref": "#/$defs/objectId" } }
        },
        {
          "properties": { "strategy": { "const": "empty_tree" }, "base_sha": { "type": "null" } }
        }
      ]
    },
    "file": {
      "type": "object",
      "additionalProperties": false,
      "required": ["status", "old_path", "new_path", "additions", "deletions", "binary", "patch", "patch_truncated", "omitted_reason"],
      "properties": {
        "status": {
          "type": "string",
          "pattern": "^[A-Z]$",
          "description": "Git's change letter: A added, M modified, D deleted, R renamed, T type changed (file/symlink/submodule), and other letters Git may report."
        },
        "old_path": { "type": ["string", "null"], "description": "Repository-relative path before the change; null when added." },
        "new_path": { "type": ["string", "null"], "description": "Repository-relative path after the change; null when deleted." },
        "additions": { "type": ["integer", "null"], "minimum": 0, "description": "Added lines; null when Git cannot count lines (binary)." },
        "deletions": { "type": ["integer", "null"], "minimum": 0, "description": "Deleted lines; null when Git cannot count lines (binary)." },
        "binary": { "type": "boolean" },
        "patch": {
          "type": ["string", "null"],
          "description": "Unified diff text as printed by git diff-tree, possibly cut at a limit. null exactly when omitted_reason is set."
        },
        "patch_truncated": { "type": "boolean", "description": "patch was cut at the per-file or per-event size limit." },
        "omitted_reason": {
          "enum": ["binary", "sensitive_path", "total_patch_limit", null],
          "description": "Why patch is null: binary file, a path that looks like it holds secrets, or the per-event patch limit was already used up."
        }
      },
      "allOf": [
        {
          "if": { "properties": { "status": { "const": "A" } } },
          "then": { "properties": { "old_path": { "type": "null" }, "new_path": { "type": "string" } } }
        },
        {
          "if": { "properties": { "status": { "const": "D" } } },
          "then": { "properties": { "old_path": { "type": "string" }, "new_path": { "type": "null" } } }
        },
        {
          "if": { "properties": { "status": { "enum": ["M", "R", "T"] } } },
          "then": { "properties": { "old_path": { "type": "string" }, "new_path": { "type": "string" } } }
        },
        {
          "if": { "properties": { "binary": { "const": true } } },
          "then": { "properties": { "patch": { "type": "null" }, "additions": { "type": "null" }, "deletions": { "type": "null" }, "omitted_reason": { "const": "binary" } } }
        },
        {
          "oneOf": [
            { "properties": { "patch": { "type": "string" }, "omitted_reason": { "type": "null" } } },
            { "properties": { "patch": { "type": "null" }, "omitted_reason": { "type": "string" }, "patch_truncated": { "const": false } } }
          ]
        }
      ]
    },
    "summary": {
      "type": "object",
      "additionalProperties": false,
      "required": ["changed_files", "included_files", "omitted_files", "truncated"],
      "properties": {
        "changed_files": { "type": "integer", "minimum": 0, "description": "Files found by the comparison." },
        "included_files": { "type": "integer", "minimum": 0, "description": "Length of the files array." },
        "omitted_files": { "type": "integer", "minimum": 0, "description": "Changed files left out of files by the file limit (changed_files - included_files)." },
        "truncated": { "type": "boolean", "description": "true when a limit cut the file list or any patch (patch_truncated or omitted_reason total_patch_limit)." }
      }
    }
  }
}
