{
  "schema_version": "1.0",
  "event_type": "commit.snapshot",
  "captured_at": "2026-09-23T22:28:11Z",
  "repository": {
    "name": "demo-repo",
    "current_branch": "main"
  },
  "commit": {
    "sha": "8cd948cf3e93db50e6b30eaab2c366131fdd538d",
    "parents": [],
    "message": "Initial commit\n",
    "author_name": "Example Developer",
    "authored_at": "2026-09-24T09:50:00+09:00",
    "committed_at": "2026-09-24T09:50:00+09:00"
  },
  "comparison": {
    "strategy": "empty_tree",
    "base_sha": null
  },
  "files": [
    {
      "status": "A",
      "old_path": null,
      "new_path": "README.md",
      "additions": 3,
      "deletions": 0,
      "binary": false,
      "patch": "diff --git a/README.md b/README.md\nnew file mode 100644\nindex 0000000..d99fb31\n--- /dev/null\n+++ b/README.md\n@@ -0,0 +1,3 @@\n+# demo-repo\n+\n+計算ライブラリのデモです。\n",
      "patch_truncated": false,
      "omitted_reason": null
    },
    {
      "status": "A",
      "old_path": null,
      "new_path": "docs/notes.txt",
      "additions": 5,
      "deletions": 0,
      "binary": false,
      "patch": "diff --git a/docs/notes.txt b/docs/notes.txt\nnew file mode 100644\nindex 0000000..94c99a3\n--- /dev/null\n+++ b/docs/notes.txt\n@@ -0,0 +1,5 @@\n+line 1\n+line 2\n+line 3\n+line 4\n+line 5\n",
      "patch_truncated": false,
      "omitted_reason": null
    },
    {
      "status": "A",
      "old_path": null,
      "new_path": "src/add.go",
      "additions": 5,
      "deletions": 0,
      "binary": false,
      "patch": "diff --git a/src/add.go b/src/add.go\nnew file mode 100644\nindex 0000000..2367180\n--- /dev/null\n+++ b/src/add.go\n@@ -0,0 +1,5 @@\n+package calc\n+\n+func add(a, b int) int {\n+\treturn a - b\n+}\n",
      "patch_truncated": false,
      "omitted_reason": null
    },
    {
      "status": "A",
      "old_path": null,
      "new_path": "src/legacy.go",
      "additions": 6,
      "deletions": 0,
      "binary": false,
      "patch": "diff --git a/src/legacy.go b/src/legacy.go\nnew file mode 100644\nindex 0000000..b7b3d9f\n--- /dev/null\n+++ b/src/legacy.go\n@@ -0,0 +1,6 @@\n+package calc\n+\n+// Old helper, kept for compatibility.\n+func sub(a, b int) int {\n+\treturn a - b\n+}\n",
      "patch_truncated": false,
      "omitted_reason": null
    }
  ],
  "summary": {
    "changed_files": 4,
    "included_files": 4,
    "omitted_files": 0,
    "truncated": false
  },
  "warnings": []
}
